{
  "$schema": "https://json-schema.org/draft/2020-12/schema",
  "$id": "https://classscribe.local/schema/v1/model-manifest-bundle.schema.json",
  "title": "ClassScribe pinned model manifest bundle index",
  "description": "Index of immutable model manifests. Entries must be unique by model_id and sorted by model_id in Unicode code-point order; the runtime loader and offline verifier enforce these cross-entry requirements.",
  "type": "object",
  "additionalProperties": false,
  "required": [
    "schema_version",
    "registry_revision",
    "facts_as_of",
    "generated_at",
    "generator",
    "manifests"
  ],
  "properties": {
    "schema_version": { "const": 1 },
    "registry_revision": { "type": "integer", "minimum": 1 },
    "facts_as_of": { "type": "string", "format": "date" },
    "generated_at": {
      "type": "string",
      "format": "date-time",
      "pattern": "^\\d{4}-\\d{2}-\\d{2}T\\d{2}:\\d{2}:\\d{2}Z$",
      "description": "UTC generation batch time controlled by SOURCE_DATE_EPOCH for reproducible generation."
    },
    "generator": {
      "type": "object",
      "additionalProperties": false,
      "required": ["name", "version", "lock_sha256"],
      "properties": {
        "name": { "const": "classscribe-model-manifest" },
        "version": { "const": "1" },
        "lock_sha256": { "$ref": "#/$defs/sha256" }
      }
    },
    "manifests": {
      "type": "array",
      "minItems": 1,
      "uniqueItems": true,
      "description": "Manifest entries, unique by model_id and sorted by model_id in Unicode code-point order.",
      "items": { "$ref": "#/$defs/manifest_entry" }
    }
  },
  "$defs": {
    "sha256": {
      "type": "string",
      "pattern": "^[0-9a-f]{64}$"
    },
    "manifest_entry": {
      "type": "object",
      "additionalProperties": false,
      "required": ["model_id", "path", "sha256"],
      "properties": {
        "model_id": {
          "type": "string",
          "pattern": "^[a-z0-9][a-z0-9._-]{0,127}$"
        },
        "path": {
          "type": "string",
          "pattern": "^[a-z0-9][a-z0-9._-]{0,127}\\.json$",
          "not": { "const": "bundle.v1.json" },
          "description": "Safe single-level JSON filename relative to the bundle directory; bundle.v1.json is reserved for this index."
        },
        "sha256": { "$ref": "#/$defs/sha256" }
      }
    }
  }
}
